cleaned_tweet,product,reply,Polarity,Sentiment
csa hiring technical specialist office sunny pensacola youll provide service naval education training command netc program netc navy dodjobs dogreatthings mission focused fun team,Office365,,0.15,Positive
sidebyside accounting software comparison quickbooks xero star gravity software entrepreneur businessgrowth strategy tech innovation clouderp microsoft powerplatform interface audittrail justsaygo online erp,Office365,,0.0,Neutral
getting started want learn aware getting started looking guidance getting going sign free email course,Office365,,0.325,Positive
microsoft security managing governance compliance feature training course learning,Office365,,0.0,Neutral
get free consultation call credit creditcard creditrepair tax loan bookkeeping finance instagram post business debt studentloan medicaldebt,Office365,,0.4,Positive
hacked cm allowed alter search result take million account well started simple click story bingbang,Office365,,0.0,Neutral
ready take business next level discover business cloud integration sharepoint office service help stay ahead game read latest article learn sharepoint digitaltransformation,Office365,,0.075,Positive
ready take business next level discover business cloud integration sharepoint office service help stay ahead game read latest article learn sharepoint digitaltransformation,Office365,,0.075,Positive
job vacancy project coordinator close read apply nh nhsjobs lancashire preston microsoft digital technicalservices,Office365,,0.0,Neutral
run bob leahy tristate trust conference want talk schedule something bob otrwithepicrps,Office365,,0.0,Neutral
rackspace hiring remote customer service technician rackspace remotework remotejob workfromhome technicalsupport express,Office365,,-0.1,Negative
backup content sky data vault today ensure protection missioncritical content automated fully managed solution rest easy knowing data safe,Office365,,0.4666666666666667,Positive
dont like prospect microsoft popup ad conference product like sharepoint there feedback item available share view issue,Office365,,0.4,Positive
occasionally play xcloud laptop minipc via gamepassultimate mainly used,Office365,,0.08333333333333333,Positive
occasionally play xcloud laptop minipc via gamepassultimate mainly used,Office365,laptop dont play cloud game install directly hard drive like console sure knew,0.08333333333333333,Positive
join beer garden welcome network reception grabbing drink pop across aisle demo latest product suite kaleidoscope book demo supplychain technology wms billing,Office365,,0.65,Positive
would assume per game abk catalog unless offer bundle abk every game like bundle includes office excel powerpoint onetime fee,Office365,,-0.4,Negative
would assume per game abk catalog unless offer bundle abk every game like bundle includes office excel powerpoint onetime fee,Office365,cgps would turn market offer use abk game appservices support business amd generate independently gamepass wouldnt expect sub counted gamepass user count mau game course,-0.4,Negative
tell others follow sharepoint travel japan foodie info tip awesome day wear mask,Office365,,1.0,Positive
exciting news starting monday may foundcares mobile health unit providing health service riviera beach new health center open schedule appointment call click link,Office365,,0.06727272727272726,Positive
backup content sky data vault today ensure protection missioncritical content automated fully managed solution rest easy knowing data safe,Office365,,0.4666666666666667,Positive
plan place childrens future cant provide anymore childrens one life insurance key optimize life insurance oasis wealth design,Office365,,0.0,Neutral
create enforce common signature office create enforce common signature,Office365,,-0.3,Negative
onedrive account contains search box search result based intelligent search search user onedrive check way search content sharepoint,Office365,,0.8,Positive
happyfriday contact discus migration away existing server setup email provider wed love hear itsupport suffolk essex,Office365,,0.5,Positive
maximize customer sale potential quotetoorder technology schedule time meet directionsasia,Office365,,0.0,Neutral
dont want popup anything office application operating system,Office365,,0.0,Neutral
microsoft updated graph powershell sdk version fixed bug script described didnt handle aipservice module update also available fun,Office365,,0.26666666666666666,Positive
thank adrian computersetup appleiphone follower apple office computerrepair microsoftteams officewears computerlove followforfollowback microsoftexcel applepodcasts officedesign applepay,Office365,,0.0,Neutral
microsoft posting inproduct ad sharepointonline think horrible idea enterprise software agree happy disturbed work popup ad,Office365,,-0.09999999999999998,Negative
dont like prospect microsoft popup ad conference product like sharepoint there feedback item available share view issue,Office365,,0.4,Positive
job vacancy project coordinator close read apply nh nhsjobs lancashire preston microsoft digital technicalservices,Office365,,0.0,Neutral
microsoft updated graph powershell sdk version fixed bug script described didnt handle aipservice module update also available fun,Office365,,0.26666666666666666,Positive
dont like prospect microsoft popup ad conference product like sharepoint there feedback item available share view issue,Office365,,0.4,Positive
dont like prospect microsoft popup ad conference product like sharepoint there feedback item available share view issue,Office365,,0.4,Positive
dont like prospect microsoft popup ad conference product like sharepoint there feedback item available share view issue,Office365,dont want popup anything office application operating system,0.4,Positive
graph sdk make sure update azure automation account latest module,Office365,,0.5,Positive
graph sdk make sure update azure automation account latest module,Office365,,0.5,Positive
create enforce common signature office create enforce common signature,Office365,,-0.3,Negative
microsoft updated graph powershell sdk version fixed bug script described didnt handle aipservice module update also available fun,Office365,,0.26666666666666666,Positive
converting microsoftteams wikis onenote make sure done team end year there way convert wikis tenant one manual process,Office365,,0.5,Positive
interested learning interpretation stress perfusion lge cmr fill logbook level certification cmr attend one interactive case review session information registration,Office365,,0.25,Positive
gartnerdw summit fast approaching annmette haugaard ground hear digitalworkplace challenge talk creating engaging new world work book time anne,Office365,,0.1840909090909091,Positive
gartnerdw summit fast approaching annmette haugaard ground hear digitalworkplace challenge talk creating engaging new world work book time anne,Office365,,0.1840909090909091,Positive
gartnerdw summit fast approaching annmette haugaard ground hear digitalworkplace challenge talk creating engaging new world work book time anne,Office365,,0.1840909090909091,Positive
exciting news usersthe latest update version released april brings host new feature amp improvement popular productivity suite need web service visit microsoftoffice microsoft,Office365,,0.3840909090909091,Positive
used software,Office365,,0.0,Neutral
easily backup office email mbox using sysinspire backup converter software without losing data programme intuitive user interface support backing multiple office account know,Office365,,0.21666666666666667,Positive
bridge cloud suite take new level microsoftteams cisco,Office365,,0.13636363636363635,Positive
vectra empowers organisation detect stop office breach security saas securityoperationscenters vectra vectraceohiteshsheth read,Office365,,0.0,Neutral
additional support business need microsoft azure service,Office365,,0.0,Neutral
vectra empowers organisation detect stop office breach security saas securityoperationscentres vectra vectraceohiteshsheth read,Office365,,0.0,Neutral
job vacancy project coordinator close read apply nh nhsjobs lancashire preston microsoft digital technicalservices,Office365,,0.0,Neutral
visual refresh available office ltsc,Office365,,0.2,Positive
visual refresh available office ltsc,Office365,,0.2,Positive
considering applying tlevel funding similar project click link book obligation discussion one expert consultant,Office365,,0.0,Neutral
quick reminder bank holiday opening hour would like enquire course diploma contact opt swordstrainingcom book free course consultation,Office365,,0.3666666666666667,Positive
enter exam season want remind save work leeds beckett student access onedrive platform save share document file follow link find use onedrive,Office365,,0.0,Neutral
simplify manage monitor data sign demo learn transforming enterprise protection privacy personal data,Office365,,0.0,Neutral
offer learning style meet need get team motivated confident enhancing skill meet learning development find support team team learninganddevelopment learning,Office365,,0.5,Positive
day left learn latest trend technology arabiantravelmarket stand sheikh saeed arena dubai world trade centre book meeting register crowneplazariyadhpalace,Office365,,0.25,Positive
ready join limitless opportunity amp growth see arabiantravelmarket stand sheikh saeed arena dubai world trade centre book meeting register holidayinnsuitestabuk,Office365,,0.2,Positive
discover office backup essential institution microsoft barracuda benefit may entitled register upcoming webinar microsoft barracuda backuprecovery,Office365,,0.0,Neutral
converting microsoftteams wikis onenote make sure done team end year there way convert wikis tenant one manual process,Office365,,0.5,Positive
converting microsoftteams wikis onenote make sure done team end year there way convert wikis tenant one manual process,Office365,,0.5,Positive
microsoft stop bundling team via software,Office365,,0.0,Neutral
use custom domain email notification within microsoft exchangeonline via vasil michev,Office365,,0.0,Neutral
close big event well share vision worldrenowned pioneer hospitality stand sheikh saeed arena dubai world trade centre book meeting register makaremhotels atmdubai,Office365,,0.0,Neutral
modernize workplace quisitives workplace modernization optimization assessment workplaceoptimization,Office365,,0.0,Neutral
aim make sure get best service whether youre buying course participating workshop see client say also book free discussion today using link,Office365,,0.6333333333333333,Positive
aim make sure get best service whether youre buying course participating workshop see client say also book free discussion today using link,Office365,coachingcentre careercoaching businessreviews,0.6333333333333333,Positive
also company like dropbox specifically think souped ability say gsuite make people finally switch away dropbox integrated cloud,Office365,,0.0,Neutral
arabiantravelmarket dubai approach day explore new travel hospitality trend stand sheikh saeed arena dubai world trade centre book meeting register riyadhairportmarriott,Office365,,0.13636363636363635,Positive
countdown join explore latest trend amp project together arabiantravelmarket stand sheikh saeed arena dubai world trade centre book meeting register holidayinnjubail,Office365,,0.5,Positive
struggling get professional signature light mail perfect ending mail made best signaturesolutions offered contact dubai website crossware exclaimer,Office365,,0.625,Positive
centrally manage email signature youre using office save lot time manually updating everyones outlook teamlucid outlook email,Office365,,0.0,Neutral
think azure cloud rev doesnt include etc understand right report separately believe,Office365,,0.2857142857142857,Positive
want custom email address org custom domain name net org etc domain ownership add custom domain dns setting service job done,Office365,,0.0,Neutral
first action call admin ask still work company hijacker say yes work thats close support ticket support incredible verification process microsoft,Office365,,0.4166666666666667,Positive
learn create distribution list office take discussion regarding distribution list forward let understand feature right method create distribution list,Office365,,0.2857142857142857,Positive
microsoft support terrible weve account suspended exemployee literally kidnapped company support team provide solution request recover password general administrator,Office365,,-0.475,Negative
microsoft support terrible weve account suspended exemployee literally kidnapped company support team provide solution request recover password general administrator,Office365,first action call admin ask still work company hijacker say yes work thats close support ticket support incredible verification process microsoft,-0.475,Negative
may national decision day quickly approaching cant wait part breakthrough barry question set oneonone,Office365,,0.0,Neutral
might want upgrade fix,Office365,,0.0,Neutral
busy implementing hris via isv program taking azure microsoft store thats closer end year,Office365,,0.1,Positive
provide advanced security solution recently secured healthcare client environment stay compliant protected multifactor authentication data loss prevention advanced threat protection hipaacompliance,Office365,,0.26666666666666666,Positive
keyboard shortcut boost productivity danielle davisroe msword excel outlook legaltech techtips,Office365,,0.0,Neutral
good frontend developer developerweek nca mtn vodafone tigo herh fante nanaaba bongo franchise service data business businessconsultants interface resellers login cloud erp dyngp healthcare financials,Office365,,0.7,Positive
sum comma separated value excel formula using textsplit lambda function subscribe download practice file excel learnexcel exceltips exceltricks exceltutorials office,Office365,,0.0,Neutral
day left meet atmdubai stand sheikh saeed arena dubai world trade centre book meeting register makaremhotels dur dubai tourism hospitality,Office365,,0.0,Neutral
join innova solution microsoft conference may la vega meet jason devereaux discus partnership opportunity microsoft project solution book meeting innovasolutions microsoft,Office365,,0.0,Neutral
maximize customer sale potential quotetoorder technology schedule time meet directionsasia,Office365,,0.0,Neutral
document scanning process document safely securely copied format pdf call losangeles encino documentscanning pdf attorney filming entertainment law,Office365,,0.4,Positive
thank following many news around onedrive sharepoint online collaboration sharing howto visit blog,Office365,,0.25,Positive
create enforce common signature office create enforce common signature,Office365,,-0.3,Negative
migrating office google workspace business roi googleworkspace datamigration business clouddata,Office365,,0.0,Neutral
additional support business need microsoft azure service,Office365,,0.0,Neutral
create inclusive content new accessibility assistant microsoft microsoft blog microsoft,Office365,,0.13636363636363635,Positive
set communication site apart regular team site quick launch lefthandside menu like group site new site collection created create communication site see,Office365,,0.15656565656565655,Positive
quickbooks multiple entity doesnt work outgrown quickbooks cloud accountingsoftware powerbi crmug interface multicompany financials familyoffice franchise smallbusiness,Office365,,0.0,Neutral
teachingthursday encourage utsafaculty bookmark vast collection teaching resource remember also book consultation oneonone teaching support consultant,Office365,,0.0,Neutral
window,Office365,,0.0,Neutral
window,Office365,thank grammarlygo currently rolled grammarly window next couple week recommend downloading grammarly window secure access rolled,0.0,Neutral
whats amazing anyone pay license typically doesnt even use feature license come example license baseline,Office365,,0.21666666666666673,Positive
support may amp double dollar save date apple google outlook,Office365,,0.0,Neutral
get free consultation call credit creditcard creditrepair tax loan bookkeeping finance instagram post business debt studentloan medicaldebt,Office365,,0.4,Positive
office powershell script send report email complete guide via,Office365,,0.1,Positive
maximize customer sale potential quotetoorder technology schedule time meet directionsasia,Office365,,0.0,Neutral
check saassprawl shadowit security group googleworkspace,Office365,,0.0,Neutral
whats new microsoft form msforms,Office365,,0.13636363636363635,Positive
ready travel tech takeover alike important show happening travel space year amp shaping future travel let talk oneonone booking atm dubai abudhabi travel,Office365,,0.20000000000000004,Positive
luke sport medicine happy announce free sport physicals summer coca cola park ironpigs way allentown june july july click link register today,Office365,,0.6000000000000001,Positive
quicktippthursday time episode german quicktipp series today present avatar microsoftteams,Office365,,0.0,Neutral
new admindroid version explore exclusive new feature admindroid sysadmin sysadmins featureupdate,Office365,,0.13636363636363635,Positive
use date validation excel help check valid email address example look entry contains symbol end com msexcel spreadsheet spreadsheet exceltips chart chart,Office365,,0.0,Neutral
hera busy shop demo week call text email get schedule well cut big gear book demo gear gearmanufacturing hobbing biggears agma,Office365,,0.05,Positive
free health assessment free discovery consultation resource supplement service program product bioanalytics,Office365,,0.4,Positive
good evening sam tia shift tonight listen chat feel free get touch email studentpeersupportacuk book call facebook twitter instagram,Office365,,0.55,Positive
ready travel tech takeover alike important show happening travel space year amp shaping future travel let talk oneonone booking atm dubai abudhabi travel,Office365,,0.20000000000000004,Positive
microsoft blocked probably non io keyboard apps like outlook team frustrating much better builtin one microsoft,Office365,,0.04999999999999999,Positive
design like pro without hassle microsoft designer prebuilt template customizable design microsoftdesigner reel customizabledesigns fyp designcollaboration realtimedesign designtools nomorehassle,Office365,,0.0,Neutral
help pro bono partner able serve vulnerable community need volunteer clinic hosting virtual inperson clinic virtualclinics probono cl legalservices,Office365,,0.0,Neutral
getting started want learn aware getting started looking guidance getting going sign free email course,Office365,,0.325,Positive
new admindroid version explore exclusive new feature admindroid sysadmin sysadmins featureupdate,Office365,,0.13636363636363635,Positive
get free consultation call credit creditcard creditrepair tax loan bookkeeping finance instagram post business debt studentloan medicaldebt,Office365,,0.4,Positive
new admindroid version explore exclusive new feature admindroid sysadmin sysadmins featureupdate,Office365,,0.13636363636363635,Positive
design like pro without hassle microsoft designer prebuilt template customizable design microsoftdesigner reel customizabledesigns fyp designcollaboration realtimedesign designtools nomorehassle,Office365,,0.0,Neutral
poc migrate google workspace office googleworkspace business datamigration clouddata,Office365,,0.0,Neutral
reselling benefit msps migrate box office box datamigration business,Office365,,0.0,Neutral
migrating office google workspace business roi googleworkspace datamigration business clouddata,Office365,,0.0,Neutral
download microsoft office soc report microsoft soc report download,Office365,,0.0,Neutral
download microsoft office soc report microsoft soc report download,Office365,,0.0,Neutral
download microsoft office soc report microsoft soc report download,Office365,,0.0,Neutral
download microsoft office soc report microsoft soc report download,Office365,,0.0,Neutral
download microsoft office soc report microsoft soc report download,Office365,,0.0,Neutral
onedrive basic part window today sync sharepointonline onedriveforbusiness onedrive,Office365,,0.0,Neutral
new accounting system right amount horsepower support growing business familyowned franchise service data business financial consultant interface resellers login cloud erp gogravity,Office365,,0.14069264069264067,Positive
excel pro trick filter data dynamically excel filter function tutorial subscribe excel learnexcel exceltips exceltricks exceltutorials office,Office365,,0.0,Neutral
actual target chart excel variance chart excel subscribe excel learnexcel exceltips exceltricks exceltutorials office,Office365,,0.0,Neutral
sum comma separated value excel formula using textsplit lambda function subscribe download practice file excel learnexcel exceltips exceltricks exceltutorials office,Office365,,0.0,Neutral
thank following many news around onedrive sharepoint online collaboration sharing howto visit blog,Office365,,0.25,Positive
backup content sky data vault today ensure protection missioncritical content automated fully managed solution rest easy knowing data safe,Office365,,0.4666666666666667,Positive
issue email marked spam appears worldwide issue received response last please resend call ask check spam box using microsoft email,Office365,,0.05,Positive
top best innovative company watch familyowned franchise business businessconsultants resellers gravitysoftware cloud erp dyngp msdynsl financials dynamicspartners,Office365,,0.6666666666666666,Positive
smartpage excel professional data analyst excel microsoft datascience analytics,Office365,,0.1,Positive
smartpage excel professional data analyst excel microsoft datascience analytics,Office365,,0.1,Positive
sapbusinessone help team collaborate increase productivity level see integrate popular tool within endtoend system,Office365,,0.6,Positive
migrated external email work fine internal email hitting exchange could issue join spiceworks community share expert advice today techissue techadvice,Office365,,0.1388888888888889,Positive
created first power automate flow,Office365,,0.25,Positive
read latest blog improve budgetfriendly traveler experience book slot upcoming arabian travel market atmdubai traveltechnology travelagency hotelbookings travel tourism reverification,Office365,,0.5,Positive
design like pro without hassle microsoft designer prebuilt template customizable design microsoftdesigner reel customizabledesigns fyp designcollaboration realtimedesign designtools nomorehassle,Office365,,0.0,Neutral
want quickly format data table excel select data click format table button join excel conversation exceltips formatting dailyexceltips excelintel microsoftoffice,Office365,,0.3333333333333333,Positive
